{
  "serviceArn": "example_value",
  "serviceName": "example_value",
  "clusterArn": "example_value",
  "loadBalancers": [],
  "serviceRegistries": [],
  "status": "example_value",
  "desiredCount": 10,
  "runningCount": 10,
  "pendingCount": 10,
  "launchType": "example_value",
  "capacityProviderStrategy": [],
  "platformVersion": "example_value",
  "platformFamily": "example_value",
  "taskDefinition": "example_value",
  "deployments": [],
  "roleArn": "example_value",
  "events": [],
  "createdAt": 42.5,
  "placementConstraints": [],
  "placementStrategy": [],
  "healthCheckGracePeriodSeconds": 10,
  "schedulingStrategy": "example_value",
  "tags": [],
  "createdBy": "example_value",
  "enableECSManagedTags": true,
  "enableExecuteCommand": true,
  "propagateTags": "example_value"
}